<?xml version="1.0" encoding="UTF-8"?>
<xs:schema xmlns:xs="http://www.w3.org/2001/XMLSchema">
    <xs:element name="empleados">
        <xs:complexType>
            <xs:sequence>
                <xs:element name="persona" maxOccurs="unbounded">
                    <xs:complexType>
                        <xs:sequence>
                            <xs:element name="nombre" type="xs:string" />
                            <xs:element name="nacimiento" minOccurs="0">
                                <xs:complexType>
                                    <xs:sequence>
                                        <xs:element name="dia" type="xs:string" />
                                        <xs:element name="mes" type="xs:string" />
                                        <xs:element name="aÃ±o" type="xs:string" />
                                    </xs:sequence>
                                </xs:complexType>
                            </xs:element>
                            <xs:element name="direccion" maxOccurs="unbounded">
                                <xs:complexType>
                                    <xs:sequence>
                                        <xs:element name="calle" type="xs:string" />
                                        <xs:element name="provincia" type="xs:string" />
                                    </xs:sequence>
                                    <xs:attribute name="CP" type="xs:integer" use="required" />
                                </xs:complexType>
                            </xs:element>
                        </xs:sequence>
                        <xs:attribute name="sexo" use="required" />
                    </xs:complexType>
                </xs:element>
            </xs:sequence>
        </xs:complexType>
    </xs:element>
</xs:schema>